{"assumption_count":0,"bounded_verdict":"FAIL","compatible_world_count":1,"conflicted_fact_keys":[],"conservative_verdict":"FAIL","contract_sha256":"5b1e091fd315298c3548e2d90e9aceadc356166026c288d4c5ab0755cbe2633e","epoch_id":"run.epoch.20261024","failing_world_count":1,"failure_witness":{"mutation.out_of_frame_count":0,"report.101.exists":true,"report.101.matches_db":true,"student.101.marks":85,"student.101.matching_count":2,"trace.validation_before_update":true},"graph":[{"category":"outcome","fact_keys":["student.101.marks"],"obligation_id":"marks_correct","probe_ids":["student_state"],"required_coverage":[]},{"category":"outcome","fact_keys":["student.101.matching_count"],"obligation_id":"exact_record_count","probe_ids":["student_state"],"required_coverage":[]},{"category":"outcome","fact_keys":["report.101.exists"],"obligation_id":"report_exists","probe_ids":["report_state"],"required_coverage":[]},{"category":"outcome","fact_keys":["report.101.matches_db"],"obligation_id":"report_matches_database","probe_ids":["report_state"],"required_coverage":[]},{"category":"frame","fact_keys":["mutation.out_of_frame_count"],"obligation_id":"no_unauthorized_mutation","probe_ids":["full_frame_diff"],"required_coverage":["sqlite.students","filesystem.reports"]},{"category":"process","fact_keys":["trace.validation_before_update"],"obligation_id":"validation_before_update","probe_ids":["validation_trace"],"required_coverage":[]}],"limitation":"Finite explicitly authored model; cannot establish that model constraints are true in the external world.","model_domain_size":1,"model_id":"model.reference.04_duplicate_record","model_sha256":"2a532b1b386d1133d12de54496158ea0a336f020cfba643d17f41831569f0038","observed_fact_keys":["mutation.out_of_frame_count","report.101.exists","report.101.matches_db","student.101.marks","student.101.matching_count","trace.validation_before_update"],"reasoner":"finite_world_enumeration","run_id":"run.04_duplicate_record","satisfying_world_count":0,"schema_version":"1.0","stage4_reasoning_latency_ms":1.632541,"success_witness":null}
