{"assumption_count":0,"bounded_verdict":"UNCERTAIN","compatible_world_count":2,"conflicted_fact_keys":[],"conservative_verdict":"UNCERTAIN","contract_sha256":"3009a56e485680891db24cc1346d45825d815bee45e4371c4103fdd0812a219a","epoch_id":"run.epoch.20261024","failing_world_count":1,"failure_witness":{"mutation.out_of_frame_count":0,"mutation.transient_out_of_frame_count":1,"report.101.exists":true,"report.101.matches_db":true,"student.101.marks":85,"student.101.matching_count":1,"trace.validation_before_update":true},"graph":[{"category":"outcome","fact_keys":["student.101.marks"],"obligation_id":"marks_correct","probe_ids":["student_state"],"required_coverage":[]},{"category":"outcome","fact_keys":["student.101.matching_count"],"obligation_id":"exact_record_count","probe_ids":["student_state"],"required_coverage":[]},{"category":"outcome","fact_keys":["report.101.exists"],"obligation_id":"report_exists","probe_ids":["report_state"],"required_coverage":[]},{"category":"outcome","fact_keys":["report.101.matches_db"],"obligation_id":"report_matches_database","probe_ids":["report_state"],"required_coverage":[]},{"category":"frame","fact_keys":["mutation.out_of_frame_count"],"obligation_id":"no_unauthorized_mutation","probe_ids":["full_frame_diff"],"required_coverage":["sqlite.students","filesystem.reports"]},{"category":"process","fact_keys":["trace.validation_before_update"],"obligation_id":"validation_before_update","probe_ids":["validation_trace"],"required_coverage":[]},{"category":"frame","fact_keys":["mutation.transient_out_of_frame_count"],"obligation_id":"no_transient_unauthorized_mutation","probe_ids":["transient_journal"],"required_coverage":["sqlite.students"]}],"limitation":"Finite explicitly authored model; cannot establish that model constraints are true in the external world.","model_domain_size":2,"model_id":"model.reference.10_unobservable_transient_effect","model_sha256":"30f90a621b8a603a990377530345dd68a931947d47519a30409fe3a8e0f4b0d3","observed_fact_keys":["mutation.out_of_frame_count","report.101.exists","report.101.matches_db","student.101.marks","student.101.matching_count","trace.validation_before_update"],"reasoner":"finite_world_enumeration","run_id":"run.10_unobservable_transient_effect","satisfying_world_count":1,"schema_version":"1.0","stage4_reasoning_latency_ms":1.987835,"success_witness":{"mutation.out_of_frame_count":0,"mutation.transient_out_of_frame_count":0,"report.101.exists":true,"report.101.matches_db":true,"student.101.marks":85,"student.101.matching_count":1,"trace.validation_before_update":true}}
