{"assumption_count":0,"bounded_verdict":"PASS","compatible_world_count":1,"conflicted_fact_keys":[],"conservative_verdict":"PASS","contract_sha256":"03a4f6826798da4effb7b950b1c64d4a851267ab93378e9bb1598a85e667b843","epoch_id":"epoch.stage2.clean","failing_world_count":0,"failure_witness":null,"graph":[{"category":"outcome","fact_keys":["student.101.marks"],"obligation_id":"marks_correct","probe_ids":["student_state"],"required_coverage":[]},{"category":"outcome","fact_keys":["student.101.matching_count"],"obligation_id":"exact_record_count","probe_ids":["student_state"],"required_coverage":[]},{"category":"outcome","fact_keys":["report.101.exists"],"obligation_id":"report_exists","probe_ids":["report_state"],"required_coverage":[]},{"category":"outcome","fact_keys":["report.101.matches_db"],"obligation_id":"report_matches_database","probe_ids":["report_state"],"required_coverage":[]},{"category":"frame","fact_keys":["mutation.out_of_frame_count"],"obligation_id":"no_unauthorized_mutation","probe_ids":["full_frame_diff"],"required_coverage":["sqlite.students","filesystem.reports"]},{"category":"process","fact_keys":["trace.validation_before_update"],"obligation_id":"validation_before_update","probe_ids":["validation_trace"],"required_coverage":[]}],"limitation":"Finite explicitly authored model; cannot establish that model constraints are true in the external world.","model_domain_size":1,"model_id":"model.local.clean","model_sha256":"937ecbe2059ebb82c2e055cdf385c3f19395676e9aa291c6c38ae1995021dc84","observed_fact_keys":["mutation.out_of_frame_count","report.101.exists","report.101.matches_db","student.101.marks","student.101.matching_count","trace.validation_before_update"],"reasoner":"finite_world_enumeration","run_id":"run.stage2.clean","satisfying_world_count":1,"schema_version":"1.0","stage4_reasoning_latency_ms":1.776774,"success_witness":{"mutation.out_of_frame_count":0,"report.101.exists":true,"report.101.matches_db":true,"student.101.marks":85,"student.101.matching_count":1,"trace.validation_before_update":true}}
