{"assumption_count":1,"bounded_verdict":"PASS","compatible_world_count":1,"conflicted_fact_keys":[],"conservative_verdict":"UNCERTAIN","contract_sha256":"3685c6fb8ac267757245e8f2dadd6e38bf11c5f76db78167a33e4569e1f42210","epoch_id":"run.epoch.20261024","failing_world_count":0,"failure_witness":null,"graph":[{"category":"outcome","fact_keys":["student.101.marks"],"obligation_id":"marks_correct","probe_ids":["student_state"],"required_coverage":[]},{"category":"outcome","fact_keys":["student.101.matching_count"],"obligation_id":"exact_record_count","probe_ids":["student_state"],"required_coverage":[]},{"category":"outcome","fact_keys":["report.101.exists"],"obligation_id":"report_exists","probe_ids":["report_state"],"required_coverage":[]},{"category":"outcome","fact_keys":["report.101.matches_db"],"obligation_id":"report_matches_database","probe_ids":["report_state"],"required_coverage":[]},{"category":"frame","fact_keys":["mutation.out_of_frame_count"],"obligation_id":"no_unauthorized_mutation","probe_ids":["full_frame_diff"],"required_coverage":["sqlite.students","filesystem.reports"]},{"category":"process","fact_keys":["trace.validation_before_update"],"obligation_id":"validation_before_update","probe_ids":["validation_trace"],"required_coverage":[]},{"category":"external","fact_keys":["external.notify.confirmed"],"obligation_id":"notification_confirmed","probe_ids":["notification_status"],"required_coverage":[]}],"limitation":"Finite explicitly authored model; cannot establish that model constraints are true in the external world.","model_domain_size":2,"model_id":"model.logical.synthetic_implied_notice","model_sha256":"6a5db5bc1d985b1f48fbba7762c86bbf2d5ed69fd0d97524781ae16dc26892d0","observed_fact_keys":["mutation.out_of_frame_count","report.101.exists","report.101.matches_db","student.101.marks","student.101.matching_count","trace.validation_before_update"],"reasoner":"finite_world_enumeration","run_id":"run.05_unobservable_notification","satisfying_world_count":1,"schema_version":"1.0","stage4_reasoning_latency_ms":2.265936,"success_witness":{"external.notify.confirmed":true,"mutation.out_of_frame_count":0,"report.101.exists":true,"report.101.matches_db":true,"student.101.marks":85,"student.101.matching_count":1,"trace.validation_before_update":true}}
